source_id,class_year,school_name_source,nmsf_count,source_title,source_url,source_date,source_content_sha256,retrieval_date,snapshot_record_type,snapshot_notes
lcps_2025_named_list_reconciliation,2025,Loudoun Valley High School,0,Class 2025 LCPS named-list school-scope reconciliation,https://www.lcps.org/article/1786023,2026-07-16,a7c89b06770cc0fea75f4fb25bc455d9549c94c8912acbffe3290e6843b1d8ed,2026-07-16,observation_count,student names intentionally omitted
lcps_2025_named_list_reconciliation,2025,Park View High School,0,Class 2025 LCPS named-list school-scope reconciliation,https://www.lcps.org/article/1786023,2026-07-16,a7c89b06770cc0fea75f4fb25bc455d9549c94c8912acbffe3290e6843b1d8ed,2026-07-16,observation_count,student names intentionally omitted
lcps_2025_named_list_reconciliation,2025,Tuscarora High School,0,Class 2025 LCPS named-list school-scope reconciliation,https://www.lcps.org/article/1786023,2026-07-16,a7c89b06770cc0fea75f4fb25bc455d9549c94c8912acbffe3290e6843b1d8ed,2026-07-16,observation_count,student names intentionally omitted
lcps_2025_named_list_reconciliation,2025,Woodgrove High School,0,Class 2025 LCPS named-list school-scope reconciliation,https://www.lcps.org/article/1786023,2026-07-16,a7c89b06770cc0fea75f4fb25bc455d9549c94c8912acbffe3290e6843b1d8ed,2026-07-16,observation_count,student names intentionally omitted
lcps_2025_named_list_reconciliation,2025,Official LCPS complete named list,57,57 LCPS Students Named National Merit Scholarship Semifinalists,https://www.lcps.org/article/1786023,2024-09-26,a7c89b06770cc0fea75f4fb25bc455d9549c94c8912acbffe3290e6843b1d8ed,2026-07-16,reconciliation_input_total,Official complete LCPS list; all distinct identities were reconciled without retaining student names.
lcps_2025_named_list_reconciliation,2025,Patch-attributed LCPS public-school partition,42,Seniors At Loudoun County Schools Named National Merit Semifinalists,https://patch.com/virginia/ashburn/seniors-loudoun-county-schools-named-national-merit-semifinalists,2024-09-11,2dbc6a3170b5a6a7522759d67a5b7f3e0e9638c54a1088574f0a0102f2bab051,2026-07-16,reconciliation_partition_count,Exactly 42 distinct identities from the official LCPS list match Patch names attributed to LCPS public schools; student names omitted.
lcps_2025_named_list_reconciliation,2025,Official TJHSST overlap partition,15,191 FCPS Students Named 2025 National Merit Semifinalists,https://www.fcps.edu/news/191-fcps-students-named-2025-national-merit-semifinalists,2024-09-12,960310e99c7480cfed639f6da8dea25610b5557c01b1184c895d029c3861f882,2026-07-16,reconciliation_partition_count,Exactly 15 distinct identities from the official LCPS list match the official TJHSST list; excluded from LCPS school allocation because TJHSST remains one row; student names omitted.
lcps_2025_named_list_reconciliation,2025,LCPS-FCPS spelling-variant resolution,,Candidate Web List,https://www.ed.gov/media/document/2025-psp-candidate-list-109852.pdf,2025-04-21,c9db81b7f46b5049000b06a660845061a2bb2ed45323439ad1adc50acaa1f331,2026-07-16,identity_spelling_resolution,"Official federal list ties the full name, Ashburn locality, and TJHSST together; resolves one LCPS/FCPS spelling variance without retaining the student name."
